name,description
Liam Johnson,"Liam Johnson is a passionate artist, known for creating breathtaking landscapes with his paintbrush."
Sophia Martinez,"Sophia Martinez, a tech-savvy entrepreneur, is the founder of a successful startup revolutionizing the e-commerce industry."
Jackson Davis,"Jackson Davis, a skilled chef, delights taste buds with his culinary creations, infusing flavors from around the world."
Olivia Taylor,"Olivia Taylor, an aspiring marine biologist, spends her days exploring the wonders of the ocean and advocating for marine conservation."
Noah Anderson,"Noah Anderson is a rising star in the world of photography, capturing life's moments with a unique and captivating perspective."
Emma Hernandez,"Emma Hernandez is a dedicated social worker, committed to making a positive impact in the lives of underprivileged communities."
Aiden Brown,"Aiden Brown, a fitness enthusiast and personal trainer, motivates others to achieve their health and wellness goals."
Ava Garcia,"Ava Garcia, a talented pianist, mesmerizes audiences with her soulful and enchanting musical performances."
Lucas Rodriguez,"Lucas Rodriguez, a software engineer, develops cutting-edge applications that simplify complex tasks and enhance user experiences."
Mia Smith,"Mia Smith, a published author, weaves compelling stories that transport readers to fantastical worlds filled with adventure."
Ethan Clark,"Ethan Clark, a skilled architect, brings visions to life through innovative and sustainable design solutions."
Isabella Lee,"Isabella Lee, a fashion designer with an eye for elegance, creates timeless pieces that redefine style and sophistication."
Oliver Wilson,"Oliver Wilson, a dedicated environmentalist, leads initiatives to promote sustainability and protect the planet."
Sophia White,"Sophia White, a medical researcher, works tirelessly to discover breakthroughs in the fight against debilitating diseases."
Elijah Turner,"Elijah Turner, a charismatic motivational speaker, inspires audiences with his messages of resilience and personal growth."
Harper Hall,"Harper Hall, a talented actress, graces the stage with her captivating performances that leave audiences in awe."
Caleb Lewis,"Caleb Lewis, a wildlife photographer, captures the beauty of nature and raises awareness about endangered species."
Amelia Thompson,"Amelia Thompson, a humanitarian and philanthropist, works towards creating positive change in the world."
Benjamin Moore,"Benjamin Moore, an aerospace engineer, contributes to advancements in space exploration and technology."
Evelyn Turner,"Evelyn Turner, a travel blogger, explores the globe and shares her adventures, enticing others to embrace wanderlust."
Samuel Wright,"Samuel Wright, a dedicated teacher, instills a love for learning and curiosity in his students."
Grace Walker,"Grace Walker, a nutritionist and fitness coach, empowers individuals to lead healthier and more active lifestyles."
Alexander Turner,"Alexander Turner, an innovative inventor, creates groundbreaking technologies that shape the future."
Lily Harris,"Lily Harris, an animal rights activist, tirelessly advocates for the welfare and protection of all creatures."
Daniel Martin,"Daniel Martin, a talented graphic designer, brings creativity and flair to every project he undertakes."
Scarlett Robinson,"Scarlett Robinson, a successful event planner, orchestrates unforgettable experiences and celebrations."
Mason Carter,"Mason Carter, a wildlife conservationist, dedicates his life to preserving ecosystems and protecting endangered species."
Zoe Davis,"Zoe Davis, a technology journalist, keeps the world informed about the latest trends and innovations."
Logan Garcia,"Logan Garcia, a professional surfer, rides the waves with skill and passion, embodying the spirit of the ocean."
Riley Hill,"Riley Hill, an up-and-coming chef, experiments with flavors and creates culinary masterpieces that delight the palate."
Henry Allen,"Henry Allen, a history professor, shares his passion for the past, making learning a fascinating journey for his students."
Chloe Turner,"Chloe Turner, a successful entrepreneur, founded a sustainable fashion brand committed to ethical practices."
Sebastian Brooks,"Sebastian Brooks, a world-renowned architect, designs iconic structures that blend seamlessly with their surroundings."
Emily Foster,"Emily Foster, a dedicated nurse, provides compassionate care and support to patients during challenging times."
Wyatt Mitchell,"Wyatt Mitchell, an investigative journalist, fearlessly uncovers the truth and sheds light on important issues."
Abigail Turner,"Abigail Turner, a marine biologist, studies the intricate ecosystems of coral reefs and advocates for their preservation."
Owen Bennett,"Owen Bennett, a software developer, creates user-friendly applications that simplify everyday tasks."
Ella Foster,"Ella Foster, a talented singer-songwriter, expresses emotions through her soulful music that resonates with audiences."
Gabriel Turner,"Gabriel Turner, a passionate environmentalist, educates communities on sustainable living practices."
Addison Brooks,"Addison Brooks, an acclaimed fashion photographer, captures the essence of style and elegance in every shot."
Matthew Bennett,"Matthew Bennett, a mathematician and researcher, explores the complexities of theoretical mathematics."
Stella Moore,"Stella Moore, an accomplished astronomer, unravels the mysteries of the cosmos through her groundbreaking research."
Jayden Harris,"Jayden Harris, an energetic fitness coach, motivates clients to achieve their health and wellness goals."
Ava Parker,"Ava Parker, a successful businesswoman, leads a global tech company with a focus on innovation and inclusivity."
Levi Mitchell,"Levi Mitchell, a dedicated high school teacher, inspires students to pursue their passions and dreams."
Natalie Allen,"Natalie Allen, an investigative reporter, uncovers hidden truths and advocates for justice."
Caleb Jackson,"Caleb Jackson, a wildlife conservationist, works to protect endangered species and their natural habitats."
Penelope Morris,"Penelope Morris, a talented sculptor, creates awe-inspiring works of art that captivate the imagination."
Julian Cooper,"Julian Cooper, an aspiring astrophysicist, delves into the complexities of the universe through research and exploration."
Victoria Reed,"Victoria Reed, a dedicated social activist, advocates for equality, justice, and positive social change."
